{
  "eventType": "WorkflowCompleted",
  "workflowRunId": "run-1",
  "workflowSpecRef": "workflow://registry/pr-review@1.0.0",
  "sequence": 13,
  "timestamp": "2026-07-07T12:00:00Z",
  "payload": {
    "terminalState": "completed",
    "outputDisclosure": {
      "mode": "metadata_only",
      "type": "object",
      "reason": "default_policy"
    }
  }
}
