{
  "eventType": "EdgeSelected",
  "workflowRunId": "run-1",
  "workflowSpecRef": "workflow://registry/pr-review@1.0.0",
  "sequence": 11,
  "timestamp": "2026-07-07T12:00:00Z",
  "nodeId": "route",
  "payload": {
    "from": "route",
    "to": "post_comment",
    "condition": {
      "kind": "decisionResult",
      "value": "post"
    },
    "reason": "decision_outcome_match"
  }
}
